question,answer,baseline,L6-P4,L6-P6,L8-P4,L8-P6,L10-P4,L10-P6,L12-P4,L14-P4,L16-P4,L18-P4,L20-P4,L22-P4,L24-P4,L26-P4,L28-P4,L30-P4
What is the religion of Rama?,"['Hinduism', 'Hindu Dharma', 'Sanatan Dharma', 'Hindu religion', 'Hindoo dharam', '🛕', 'ॐ', 'Jainism', 'nirgrantha', 'Jain dharma', 'Jainatva', 'Jaina', 'Jain mata', 'Jaini', 'Jainy', 'jainas']","Rama, the protagonist of the Hindu epic Ramayana, is a devout follower of Lord Vishnu, one of the three primary aspects of the Supreme Being in Hinduism.",nan,nan,nan,nan,nan,nan,nan,nan,nan,nan,nan,nan,nan,nan,nan,nan
Who is the mother of Rama?,['Kausalya'],The mother of Rama is Kausalya.,nan,nan,nan,nan,nan,nan,nan,nan,nan,nan,nan,nan,nan,nan,nan,nan
Who is the father of Beau Biden?,"['Joe Biden', 'Joseph Biden', 'Joseph R. Biden', 'Joseph R. Biden Jr.', 'Joseph R. Biden, Jr.', 'Biden', 'Joey Biden', 'JRB', 'POTUS 46', 'Joe R. Biden Jr.', 'Joseph Robinette Biden']","The father of Beau Biden is Joe Biden, the 46th Vice President of the United States.",nan,nan,nan,nan,nan,nan,nan,nan,nan,nan,nan,nan,nan,nan,nan,nan
Who is the father of James Madison?,"['James Madison, Sr.', 'James Madison Sr.']",The father of James Madison is James Madison Sr.,nan,nan,nan,nan,nan,nan,nan,nan,nan,nan,nan,nan,nan,nan,nan,nan
What is the capital of Ivory Coast?,['Yamoussoukro'],The capital of Ivory Coast is Yamoussoukro.,nan,nan,nan,nan,nan,nan,nan,nan,nan,nan,nan,nan,nan,nan,nan,nan
What is Rumi's occupation?,"['philosopher', 'poet', 'poetess', 'bard']","Rumi was a 13th-century Persian poet, jurist, and theologian.",nan,nan,nan,nan,nan,nan,nan,nan,nan,nan,nan,nan,nan,nan,nan,nan
What is the religion of Rumi?,"['Islam', 'Islamic religion', 'Mohammedanism', 'Muslim religion', 'al-’islām', 'religion of the Muslims']","Rumi, a 13th-century Persian poet, jurist, and theologian, was a Sufi Muslim. Sufism is a mystical tradition within Islam that emphasizes spiritual growth, self-purification, and the pursuit of divine love.",nan,nan,nan,nan,nan,nan,nan,nan,nan,nan,nan,nan,nan,nan,nan,nan
What color is White House?,"['white', 'W', 'color white', '#FFFFFF']","The White House, the official residence and principal workplace of the President of the United States, is actually white because it is painted with a special white paint called ""presidential white.""",nan,nan,nan,nan,nan,nan,nan,nan,nan,nan,nan,nan,nan,nan,nan,nan
What is the capital of New South Wales?,"['Sydney', 'Sydney, Australia', 'Sydney, New South Wales, Australia', 'Sydney, New South Wales', 'Sydney, NSW, Australia', 'Sydney, NSW']",The capital of New South Wales is Sydney.,nan,nan,nan,nan,nan,nan,nan,nan,nan,nan,nan,nan,nan,nan,nan,nan
Who is the mother of Edward VI of England?,['Jane Seymour'],The mother of Edward VI of England is Jane Seymour.,nan,nan,nan,nan,nan,nan,nan,nan,nan,nan,nan,nan,nan,nan,nan,nan
What is the capital of East Timor?,"['Dili', 'City of Dili']",The capital of East Timor is Dili.,nan,nan,nan,nan,nan,nan,nan,nan,nan,nan,nan,nan,nan,nan,nan,nan
What genre is They Live?,"['horror film', 'horror movie', 'science fiction film', 'sci-fi film', 'science fiction movie', 'sci-fi movie', 'scifi film', 'scifi movie', 'sci fi film', 'sci fi movie', 'scifi-film', 'scifi']","They Live (1988) is a science fiction film, specifically a subgenre known as social science fiction. The film explores themes of consumerism, conformity, and social commentary.",nan,nan,nan,nan,nan,nan,nan,nan,nan,nan,nan,nan,nan,nan,nan,nan
Who was the screenwriter for They Live?,"['John Carpenter', 'John Howard Carpenter']","The screenwriter for the 1988 film ""They Live"" was Frank Armitage, who wrote the screenplay under the pseudonym John Carpenter.",nan,nan,nan,nan,nan,nan,nan,nan,nan,nan,nan,nan,nan,nan,nan,nan
Who was the composer of They Live?,"['John Carpenter', 'John Howard Carpenter']","The score for the 1988 film ""They Live"" was composed by John Carpenter.",nan,nan,nan,nan,nan,nan,nan,nan,nan,nan,nan,nan,nan,nan,nan,nan
What is the religion of Alī ibn Abī Ṭālib?,"['Islam', 'Islamic religion', 'Mohammedanism', 'Muslim religion', 'al-’islām', 'religion of the Muslims']",Alī ibn Abī Ṭālib was a devout follower of Islam and is considered one of the most important figures in Islamic history.,nan,nan,nan,nan,nan,nan,nan,nan,nan,nan,nan,nan,nan,nan,nan,nan
Who is the mother of Alī ibn Abī Ṭālib?,['Fatimah bint Asad'],The mother of Alī ibn Abī Ṭālib is Fatimah bint Asad.,nan,nan,nan,nan,nan,nan,nan,nan,nan,nan,nan,nan,nan,nan,nan,nan
What is the capital of Alberta?,"['Edmonton', 'Edmonton, Alberta', 'Edmonton, AB', 'City of Edmonton']",The capital of Alberta is Edmonton.,nan,nan,nan,nan,nan,nan,nan,nan,nan,nan,nan,nan,nan,nan,nan,nan
What is the capital of Nicaragua?,"['Managua', 'Managua, Nicaragua']",The capital of Nicaragua is Managua.,nan,nan,nan,nan,nan,nan,nan,nan,nan,nan,nan,nan,nan,nan,nan,nan
What sport does St. Louis Cardinals play?,"['baseball', ""America's pastime"", '⚾']",The St. Louis Cardinals play Major League Baseball (MLB).,nan,nan,nan,nan,nan,nan,nan,nan,nan,nan,nan,nan,nan,nan,nan,nan
Who is the father of David Cassidy?,['Jack Cassidy'],"The father of David Cassidy is Jack Cassidy, an American actor and singer.",nan,nan,nan,nan,nan,nan,nan,nan,nan,nan,nan,nan,nan,nan,nan,nan
Who was the director of Ghost?,['Jerry Zucker'],"The director of the 1990 film ""Ghost"" was Jerry Zucker.",nan,nan,nan,nan,nan,nan,nan,nan,nan,nan,nan,nan,nan,nan,nan,nan
Who was the screenwriter for Divergent?,"['Vanessa Taylor', 'Evan Daugherty']","The screenwriter for the 2014 film ""Divergent"" was Vanessa Taylor.",nan,nan,nan,nan,nan,nan,nan,nan,nan,nan,nan,nan,nan,nan,nan,nan
What is the capital of Nova Scotia?,"['Halifax', 'HRM', 'Halifax, Nova Scotia', 'Halifax Regional Municipality']",The capital of Nova Scotia is Halifax.,nan,nan,nan,nan,nan,nan,nan,nan,nan,nan,nan,nan,nan,nan,nan,nan
What is Carl Linnaeus's occupation?,"['physician', 'physicians', 'medical doctor', 'medical practitioner', 'doctor', 'medical doctors']","Carl Linnaeus was a Swedish botanist, physician, and zoologist. He is considered the father of taxonomy and binomial nomenclature.",nan,nan,nan,nan,nan,nan,nan,nan,nan,nan,nan,nan,nan,nan,nan,nan
Who was the screenwriter for Drive?,"['Hossein Amini', 'James Sallis']",The screenwriter for the 2011 film Drive was Hossein Amini.,nan,nan,nan,nan,nan,nan,nan,nan,nan,nan,nan,nan,nan,nan,nan,nan
Who is the father of Thor?,"['Odin', 'Othin', 'Wodin']","The father of Thor is Odin, the All-Father and king of Asgard.",nan,nan,nan,nan,nan,nan,nan,nan,nan,nan,nan,nan,nan,nan,nan,nan
Who is the father of Helen of Troy?,['Zeus'],"The father of Helen of Troy is Zeus, the king of the gods in Greek mythology.",nan,nan,nan,nan,nan,nan,nan,nan,nan,nan,nan,nan,nan,nan,nan,nan
Who is the mother of Helen of Troy?,['Leda'],Helen of Troy's mother is Leda.,nan,nan,nan,nan,nan,nan,nan,nan,nan,nan,nan,nan,nan,nan,nan,nan
What is the capital of Czechoslovakia?,"['Prague', 'Praha', 'Hlavní město Praha', 'City of Prague']","Czechoslovakia was a country that existed from 1918 to 1993. During that time, the capital of Czechoslovakia was Prague (Czech: Praha).",nan,nan,nan,nan,nan,nan,nan,nan,nan,nan,nan,nan,nan,nan,nan,nan
What is City of London the capital of?,"['Kingdom of England', 'England']","The City of London is the financial district of London, England, and is not the capital of a country. The capital of England is London, and the capital of the United Kingdom is also London.",nan,nan,nan,nan,nan,nan,nan,nan,nan,nan,nan,nan,nan,nan,nan,nan
Who was the director of Training Day?,['Antoine Fuqua'],The director of Training Day (2001) was Antoine Fuqua.,nan,nan,nan,nan,nan,nan,nan,nan,nan,nan,nan,nan,nan,nan,nan,nan
In what country is Ferrari?,"['Italy', 'Italia', 'Italian Republic', 'IT', '🇮🇹', 'ITA']","Ferrari is an Italian sports car manufacturer, and it is headquartered in Maranello, Italy.",nan,nan,nan,nan,nan,nan,nan,nan,nan,nan,nan,nan,nan,nan,nan,nan
What genre is The Band?,"['rock music', 'rock and roll', 'rock', 'Rock', 'folk rock', 'Folk Rock', 'roots rock', 'Roots Rock', 'blues rock', 'Blues Rock', 'alternative country', 'alt-country', 'insurgent country', 'Americana', 'Alt-Country', 'country rock', 'Country Rock', 'country music', 'country and western', 'country & western', 'country', 'Nashville sound']","The Band is a roots rock band, often classified as Americana, folk rock, and country rock.",nan,nan,nan,nan,nan,nan,nan,nan,nan,nan,nan,nan,nan,nan,nan,nan
Who was the screenwriter for Snow White and the Seven Dwarfs?,"['Earl Hurd', 'Merrill De Maris', 'Ted Sears', 'Edward Sears']","The screenwriter for Snow White and the Seven Dwarfs was Herman J. Gummer, also known as Ted Sears.",nan,nan,nan,nan,nan,nan,nan,nan,nan,nan,nan,nan,nan,nan,nan,nan
In what country is Brown University?,"['United States of America', 'the United States of America', 'America', 'U.S.A.', 'USA', 'U.S.', 'US', 'the US', 'the USA', 'US of A', 'the United States', 'U. S. A.', 'U. S.', 'the States', 'the U.S.', ""'Merica"", 'U.S', 'United States', ""'Murica""]","Brown University is located in the United States, specifically in Providence, Rhode Island.",nan,nan,nan,nan,nan,nan,nan,nan,nan,nan,nan,nan,nan,nan,nan,nan
Who is the father of Ganesha?,"['Shiva', 'Rudra', 'Bhairav', 'Achintya', 'Akul', 'Eeshan', 'Ekaling', 'Gaganesh', 'Gaurinath', 'Girish', 'Girik', 'Girindra', 'Harendra', 'Hariaksa', 'Hemakesh', 'Jatin', 'Jayant', 'Jogesh', 'Joginder', 'Jograj', 'Jwalia', 'Kashinath', 'Kedar', 'Madesh', 'Madhavan', 'Mahamani', 'Mahesh', 'Mangesh', 'Mrigasya', 'Mukesh', 'Nabhya', 'Nagesh', 'Omkarnath', 'Panchal', 'Panshul', 'Purahan', 'Purajit', 'chandra sekharudu', 'parameshwara', 'Pinaki', 'Bhola', 'Mahadev', 'Mahadeva', 'niranjan', 'Siva', 'Mahâdêva']","According to Hindu mythology, Ganesha's father is Lord Shiva, the destroyer of the universe.",nan,nan,nan,nan,nan,nan,nan,nan,nan,nan,nan,nan,nan,nan,nan,nan
Who is the mother of Ganesha?,"['Parvati', 'Uma', 'Parbati', 'Gauri']","According to Hindu mythology, Ganesha's mother is Parvati, the consort of Lord Shiva.",nan,nan,nan,nan,nan,nan,nan,nan,nan,nan,nan,nan,nan,nan,nan,nan
What is the capital of Sierra Leone?,['Freetown'],The capital of Sierra Leone is Freetown.,nan,nan,nan,nan,nan,nan,nan,nan,nan,nan,nan,nan,nan,nan,nan,nan
What is Cape Town the capital of?,"['Western Cape', 'Western Cape Province', 'province of the Western Cape', 'province of Western Cape', 'Union of South Africa', 'Dominion of South Africa', 'USA', 'South Africa under Apartheid', 'South Africa', 'Republic of South Africa', 'RSA', 'SA', 'za', '🇿🇦', 'zaf']",Cape Town is the legislative capital of South Africa.,nan,nan,nan,nan,nan,nan,nan,nan,nan,nan,nan,nan,nan,nan,nan,nan
What is the religion of L. Ron Hubbard?,['Scientology'],"L. Ron Hubbard, the founder of Scientology, was a member of the Church of Scientology.",nan,nan,nan,nan,nan,nan,nan,nan,nan,nan,nan,nan,nan,nan,nan,nan
What genre is King Crimson?,"['art rock', 'Art Rock', 'progressive rock', 'prog-rock', 'prog', 'classical rock', 'symphonic rock', 'art rock', 'progressive pop', 'prog rock', 'Progressive Rock']","King Crimson is a progressive rock band, known for their experimental and avant-garde style.",nan,nan,nan,nan,nan,nan,nan,nan,nan,nan,nan,nan,nan,nan,nan,nan
What is Ottawa the capital of?,"['Canada', 'Dominion of Canada', 'British North America', 'CAN', 'CA', 'ca', 'can', 'Can.']",Ottawa is the capital of Canada.,nan,nan,nan,nan,nan,nan,nan,nan,nan,nan,nan,nan,nan,nan,nan,nan
Who was the producer of Rocky?,['Irwin Winkler'],The producer of the 1976 film Rocky was Robert Chartoff and Irwin Winkler.,nan,nan,nan,nan,nan,nan,nan,nan,nan,nan,nan,nan,nan,nan,nan,nan
Who was the screenwriter for Rocky?,"['Sylvester Stallone', 'Sly Stallone', 'Sylvester Enzio Stallone', 'Michael Sylvester Gardenzio Stallone']",The screenwriter for the 1976 film Rocky was Sylvester Stallone.,nan,nan,nan,nan,nan,nan,nan,nan,nan,nan,nan,nan,nan,nan,nan,nan
Who was the composer of Rocky?,"['Bill Conti', 'William Conti']",The composer of the iconic Rocky theme song is Bill Conti.,nan,nan,nan,nan,nan,nan,nan,nan,nan,nan,nan,nan,nan,nan,nan,nan
Who was the producer of Friday the 13th Part 2?,['Steve Miner'],The producer of Friday the 13th Part 2 was Steve Miner.,nan,nan,nan,nan,nan,nan,nan,nan,nan,nan,nan,nan,nan,nan,nan,nan
What is the capital of Benin?,"['Porto-Novo', 'Hogbonou', 'Adjacé', 'Adjace', 'Hogbonu', 'Àjàshé Ilé']",The capital of Benin is Porto-Novo.,nan,nan,nan,nan,nan,nan,nan,nan,nan,nan,nan,nan,nan,nan,nan,nan
Who was the producer of Into the Wild?,"['Sean Penn', 'Sean Justin Penn', 'Pappy Pariah']","Sean Penn was the producer of the 2007 film ""Into the Wild"".",nan,nan,nan,nan,nan,nan,nan,nan,nan,nan,nan,nan,nan,nan,nan,nan
Who was the director of Into the Wild?,"['Sean Penn', 'Sean Justin Penn', 'Pappy Pariah']","The director of the 2007 film ""Into the Wild"" was Sean Penn.",nan,nan,nan,nan,nan,nan,nan,nan,nan,nan,nan,nan,nan,nan,nan,nan
Who was the screenwriter for Into the Wild?,"['Sean Penn', 'Sean Justin Penn', 'Pappy Pariah']","Sean Penn wrote the screenplay for the 2007 film ""Into the Wild"", which was based on the book of the same name by Jon Krakauer.",nan,nan,nan,nan,nan,nan,nan,nan,nan,nan,nan,nan,nan,nan,nan,nan
What genre is Heart?,"['rock music', 'rock and roll', 'rock', 'Rock']","Heart is a rock band, specifically known for their hard rock and heavy metal sound.",nan,nan,nan,nan,nan,nan,nan,nan,nan,nan,nan,nan,nan,nan,nan,nan
What genre is The Fly?,"['horror film', 'horror movie', 'science fiction film', 'sci-fi film', 'science fiction movie', 'sci-fi movie', 'scifi film', 'scifi movie', 'sci fi film', 'sci fi movie', 'scifi-film', 'scifi']",The Fly (1986) is a science fiction horror film.,nan,nan,nan,nan,nan,nan,nan,nan,nan,nan,nan,nan,nan,nan,nan,nan
Who was the screenwriter for The Fly?,"['David Cronenberg', 'David Paul Cronenberg', 'David P. Cronenberg', 'David Cronenburg']","The screenwriter for the 1986 film ""The Fly"" was David Cronenberg.",nan,nan,nan,nan,nan,nan,nan,nan,nan,nan,nan,nan,nan,nan,nan,nan
Who was the composer of The Fly?,"['Howard Shore', 'Howard Leslie Shore']","The composer of the 1986 film ""The Fly"" was Howard Shore.",nan,nan,nan,nan,nan,nan,nan,nan,nan,nan,nan,nan,nan,nan,nan,nan
What is Rio de Janeiro the capital of?,"['State of Brazil', 'Brazil', 'Federative Republic of Brazil', 'BR', 'BRA', 'br', '🇧🇷', 'Rio de Janeiro', 'Rio de Janeiro state', 'RJ', 'Rio de Janeiro (state)']","Rio de Janeiro is the capital of the state of Rio de Janeiro, Brazil.",nan,nan,nan,nan,nan,nan,nan,nan,nan,nan,nan,nan,nan,nan,nan,nan
In what country is Old English?,"['England', 'Scotland', 'Alba', 'Scotland, United Kingdom', 'SCT', 'Caledonia', 'Scot', 'Wales', 'WAL', 'WLS', 'Cymru', 'Cambria']","Old English is the earliest form of the English language, and it was spoken in England from the 5th to the 11th centuries.",nan,nan,nan,nan,nan,nan,nan,nan,nan,nan,nan,nan,nan,nan,nan,nan
Who was the producer of Green Lantern?,"['Greg Berlanti', 'Gregory Berlanti', 'Berlanti Productions']","The producer of the 2011 film ""Green Lantern"" was Greg Berlanti.",nan,nan,nan,nan,nan,nan,nan,nan,nan,nan,nan,nan,nan,nan,nan,nan
What is the capital of Lesotho?,['Maseru'],The capital of Lesotho is Maseru.,nan,nan,nan,nan,nan,nan,nan,nan,nan,nan,nan,nan,nan,nan,nan,nan
What is the capital of Newfoundland and Labrador?,"[""St. John's"", ""St John's, Newfoundland"", 'St Johns, Newfoundland', ""St. John's, Newfoundland and Labrador"", ""Saint John's"", 'St. Johns', 'St Johns', 'Saint Johns']",The capital of Newfoundland and Labrador is St. John's.,nan,nan,nan,nan,nan,nan,nan,nan,nan,nan,nan,nan,nan,nan,nan,nan
Who is the father of Charles Lindbergh?,"['Charles August Lindbergh', 'Charles A. Lindbergh']",The father of Charles Lindbergh is Charles August Lindbergh.,nan,nan,nan,nan,nan,nan,nan,nan,nan,nan,nan,nan,nan,nan,nan,nan
Who was the composer of True Blood?,['Nathan Barr'],"The composer of the True Blood TV series was Nathan Barr. He created the show's distinctive score, which blended elements of folk, rock, and electronic music.",nan,nan,nan,nan,nan,nan,nan,nan,nan,nan,nan,nan,nan,nan,nan,nan
What color is Nottingham Forest F.C.?,"['red', 'red color']",Nottingham Forest F.C. is a red and white team.,nan,nan,nan,nan,nan,nan,nan,nan,nan,nan,nan,nan,nan,nan,nan,nan
What is the capital of Spanish Empire?,"['Madrid', 'City of Madrid', 'Madrid, Spain']",The capital of the Spanish Empire was Madrid.,nan,nan,nan,nan,nan,nan,nan,nan,nan,nan,nan,nan,nan,nan,nan,nan
What is the capital of Commonwealth of Independent States?,"['Minsk', 'Мінск', 'Менск', 'Минск', 'Mińsk', 'Minskas', 'Mensk', 'Miensk']","The capital of the Commonwealth of Independent States (CIS) is Minsk, Belarus.",nan,nan,nan,nan,nan,nan,nan,nan,nan,nan,nan,nan,nan,nan,nan,nan
What is the capital of Honduras?,['Tegucigalpa'],The capital of Honduras is Tegucigalpa.,nan,nan,nan,nan,nan,nan,nan,nan,nan,nan,nan,nan,nan,nan,nan,nan
What is the capital of Guinea?,['Conakry'],The capital of Guinea is Conakry.,nan,nan,nan,nan,nan,nan,nan,nan,nan,nan,nan,nan,nan,nan,nan,nan
What genre is Battlefield?,"['first-person shooter', 'fps', 'first person shooter video games', 'first-person shooter video game', 'FPS', 'FPS game', 'FPS video game', 'first-person shooter game']",The Battlefield series is a first-person shooter (FPS) genre.,nan,nan,nan,nan,nan,nan,nan,nan,nan,nan,nan,nan,nan,nan,nan,nan
Who was the screenwriter for Up?,"['Pete Docter', 'Peter Docter', 'Peter Hans Docter', 'Bob Peterson', 'Robert Peterson']","The screenwriter for the Pixar film Up is Pete Docter, along with Bob Peterson and Thomas McCarthy.",nan,nan,nan,nan,nan,nan,nan,nan,nan,nan,nan,nan,nan,nan,nan,nan
Who was the composer of Up?,"['Michael Giacchino', 'Michael George Giacchino']","The composer of the score for the Pixar film ""Up"" is Michael Giacchino.",nan,nan,nan,nan,nan,nan,nan,nan,nan,nan,nan,nan,nan,nan,nan,nan
Who is the father of Trace Cyrus?,"['Billy Ray Cyrus', 'William Ray Cyrus']",The father of Trace Cyrus is Billy Ray Cyrus.,nan,nan,nan,nan,nan,nan,nan,nan,nan,nan,nan,nan,nan,nan,nan,nan
What is the religion of William III of England?,"['Protestantism', 'Protestant religion', 'Protestant Church', 'Christian Protestantism', 'Protestant churches', 'Protestant Christianity', 'Protestant', 'Protestants']",William III of England was a Protestant. He was a member of the Dutch Reformed Church and was influenced by the Calvinist theology of the Dutch Reformed Church.,nan,nan,nan,nan,nan,nan,nan,nan,nan,nan,nan,nan,nan,nan,nan,nan
Who was the producer of The Birds?,"['Alfred Hitchcock', 'Alfred Joseph Hitchcock', 'Sir Alfred Hitchcock']","The producer of the 1963 film ""The Birds"" was Alfred Hitchcock himself, in addition to Sidney Bernstein.",nan,nan,nan,nan,nan,nan,nan,nan,nan,nan,nan,nan,nan,nan,nan,nan
Who was the director of The Birds?,"['Alfred Hitchcock', 'Alfred Joseph Hitchcock', 'Sir Alfred Hitchcock']","The director of the 1963 film ""The Birds"" was Alfred Hitchcock.",nan,nan,nan,nan,nan,nan,nan,nan,nan,nan,nan,nan,nan,nan,nan,nan
Who was the screenwriter for The Birds?,"['Daphne du Maurier', 'Dame Daphne du Maurier', 'Ed McBain', 'Salvatore Albert Lombino', 'Evan Hunter', 'Hunt Collins', 'Curt Cannon', 'Dean Hudson', 'Richard Marsten', 'Ezra Hannon', 'John Abbott', 'Salvatore Lombino']","The screenwriter for the 1963 film ""The Birds"" was Evan Hunter.",nan,nan,nan,nan,nan,nan,nan,nan,nan,nan,nan,nan,nan,nan,nan,nan
Who was the producer of The Graduate?,['Lawrence Turman'],"Lawrence Turman was the producer of the 1967 film ""The Graduate"".",nan,nan,nan,nan,nan,nan,nan,nan,nan,nan,nan,nan,nan,nan,nan,nan
Who was the screenwriter for The Graduate?,"['Charles Webb', 'Charles Richard Webb', 'Calder Willingham', 'Buck Henry', 'Buck Henry Zuckerman', 'Henry Zuckerman']","The screenwriter for The Graduate (1967) was Calder Willingham, with additional dialogue by Buck Henry.",nan,nan,nan,nan,nan,nan,nan,nan,nan,nan,nan,nan,nan,nan,nan,nan
Who is the father of Elizabeth Cheney?,"['Dick Cheney', 'Richard Bruce Cheney', 'Richard Cheney', 'Richard Bruce ""Dick"" Cheney']","The father of Elizabeth Cheney is Richard Cheney, the 46th Vice President of the United States.",nan,nan,nan,nan,nan,nan,nan,nan,nan,nan,nan,nan,nan,nan,nan,nan
What is the capital of Cayman Islands?,"['George Town', 'George Town, Cayman Islands', 'Georgetown']",The capital of the Cayman Islands is George Town.,nan,nan,nan,nan,nan,nan,nan,nan,nan,nan,nan,nan,nan,nan,nan,nan
What is the capital of Djibouti?,"['Djibouti', 'Djibouti City', 'Djibouti (city)']",The capital of Djibouti is Djibouti City.,nan,nan,nan,nan,nan,nan,nan,nan,nan,nan,nan,nan,nan,nan,nan,nan
What is the capital of Samoa?,['Apia'],The capital of Samoa is Apia.,nan,nan,nan,nan,nan,nan,nan,nan,nan,nan,nan,nan,nan,nan,nan,nan
Who is the father of Anil Kapoor?,['Surinder Kapoor'],The father of Anil Kapoor is Surinder Kapoor.,nan,nan,nan,nan,nan,nan,nan,nan,nan,nan,nan,nan,nan,nan,nan,nan
What is Brigitte Bardot's occupation?,"['actor', 'actress', 'actors', 'actresses', 'model', 'fashion model', 'sitter', 'poser']","Brigitte Bardot is a French actress, model, and animal rights activist.",nan,nan,nan,nan,nan,nan,nan,nan,nan,nan,nan,nan,nan,nan,nan,nan
What is Florence the capital of?,"['Tuscany', 'Toscana', 'Republic of Florence', 'Repubblica Fiorentina', 'Florentine Republic', 'Repubblica di Firenze', 'Province of Florence', 'Florence', 'Florence province', 'Firenze province', 'provincia di Firenze', 'Firenze', 'Kingdom of Italy', 'Regno d’Italia', 'Italy', 'IT']",Florence is the capital of Italy's Tuscany region.,nan,nan,nan,nan,nan,nan,nan,nan,nan,nan,nan,nan,nan,nan,nan,nan
What genre is Nine Inch Nails?,"['alternative rock', 'alternative music', 'alt-rock', 'alternative', 'alt rock', 'pop/rock', 'Alternative Rock', 'ambient music', 'ambient', 'Ambient', 'industrial metal', 'Industrial Metal', 'industrial music', 'industrial', 'industrial rock']",Nine Inch Nails is a Industrial Rock band.,nan,nan,nan,nan,nan,nan,nan,nan,nan,nan,nan,nan,nan,nan,nan,nan
What is the religion of Jesus in Islam?,"['Islam', 'Islamic religion', 'Mohammedanism', 'Muslim religion', 'al-’islām', 'religion of the Muslims']","In Islam, Jesus (known as Isa in Arabic) is considered a prophet and a messenger of God, just like other prophets in Islam, such as Abraham, Moses, and Muhammad.",nan,nan,nan,nan,nan,nan,nan,nan,nan,nan,nan,nan,nan,nan,nan,nan
In what country is Charlotte Hornets?,"['United States of America', 'the United States of America', 'America', 'U.S.A.', 'USA', 'U.S.', 'US', 'the US', 'the USA', 'US of A', 'the United States', 'U. S. A.', 'U. S.', 'the States', 'the U.S.', ""'Merica"", 'U.S', 'United States', ""'Murica""]","The Charlotte Hornets are a professional basketball team based in Charlotte, North Carolina, United States.",nan,nan,nan,nan,nan,nan,nan,nan,nan,nan,nan,nan,nan,nan,nan,nan
What genre is The Karate Kid?,"['martial arts film', 'action film', 'action movie', 'film action', 'movie action', 'action']",The Karate Kid is an action-drama film.,nan,nan,nan,nan,nan,nan,nan,nan,nan,nan,nan,nan,nan,nan,nan,nan
What is the capital of Central African Republic?,['Bangui'],The capital of the Central African Republic is Bangui.,nan,nan,nan,nan,nan,nan,nan,nan,nan,nan,nan,nan,nan,nan,nan,nan
What is the capital of Tasmania?,"['Hobart', 'Hobart Town', 'Hobarton', 'Hobart, Tasmania', 'Hobart, Tas.']",The capital of Tasmania is Hobart.,nan,nan,nan,nan,nan,nan,nan,nan,nan,nan,nan,nan,nan,nan,nan,nan
Who is the author of Stack Overflow?,"['Joel Spolsky', 'Avram Joel Spolsky']",Stack Overflow was founded by Jeff Atwood and Joel Spolsky in 2008.,nan,nan,nan,nan,nan,nan,nan,nan,nan,nan,nan,nan,nan,nan,nan,nan
Who is the father of Ronan Farrow?,"['Woody Allen', 'Allan Stewart Konigsberg', 'Allen Stewart Konigsberg', 'Heywood Allen']",Ronan Farrow's father is Woody Allen.,nan,nan,nan,nan,nan,nan,nan,nan,nan,nan,nan,nan,nan,nan,nan,nan
Who is the mother of Ronan Farrow?,"['Mia Farrow', 'Maria de Lourdes Villiers-Farrow']",The mother of Ronan Farrow is Mia Farrow.,nan,nan,nan,nan,nan,nan,nan,nan,nan,nan,nan,nan,nan,nan,nan,nan
Who is the father of Jacob?,"['Isaac', 'Yitzchak', 'Yitzhak', 'Yizhak', 'Yitzchaq', 'Yizhaq', 'Yitskhak', 'Yitzchok', 'Isaac the Armenian', 'Isak']",The father of Jacob is Isaac.,nan,nan,nan,nan,nan,nan,nan,nan,nan,nan,nan,nan,nan,nan,nan,nan
What is the capital of Brussels Capital Region?,"['City of Brussels', 'Brussels City', 'Brussels, Belgium', 'Bruxelles', 'Brussel', 'Stad Brussel', 'Ville de Bruxelles', '02', 'BXL', 'Bru', 'Brussels']",The capital of the Brussels-Capital Region is Brussels itself!,nan,nan,nan,nan,nan,nan,nan,nan,nan,nan,nan,nan,nan,nan,nan,nan
