question,answer,baseline,L6-P4,L6-P6,L8-P4,L8-P6,L10-P4,L10-P6,L12-P4,L14-P4,L16-P4,L18-P4,L20-P4,L22-P4,L24-P4,L26-P4,L28-P4,L30-P4
What is the capital of Iceland?,"['Reykjavík', 'Reykjavíkurborg', 'Reykjavik', 'Reykjavikurborg']",The capital of Iceland is Reykjavik!,nan,nan,nan,nan,nan,nan,nan,nan,nan,nan,nan,nan,nan,nan,nan,nan
What is the capital of Greece?,['Athens'],The capital of Greece is Athens (Ελλάδα).,nan,nan,nan,nan,nan,nan,nan,nan,nan,nan,nan,nan,nan,nan,nan,nan
What is the capital of Maryland?,"['Annapolis', 'Annapolis, Maryland']",The capital of Maryland is Annapolis.,nan,nan,nan,nan,nan,nan,nan,nan,nan,nan,nan,nan,nan,nan,nan,nan
Who was the composer of Hamilton?,"['Lin-Manuel Miranda', 'LMM']",The composer of Hamilton is Lin-Manuel Miranda.,nan,nan,nan,nan,nan,nan,nan,nan,nan,nan,nan,nan,nan,nan,nan,nan
What is the capital of Austria?,"['Vienna', 'Wien', 'Vienna, Austria', 'W']",The capital of Austria is Vienna!,nan,nan,nan,nan,nan,nan,nan,nan,nan,nan,nan,nan,nan,nan,nan,nan
What is the capital of Lebanon?,['Beirut'],The capital of Lebanon is Beirut.,nan,nan,nan,nan,nan,nan,nan,nan,nan,nan,nan,nan,nan,nan,nan,nan
Who is the mother of Thomas Jefferson?,['Jane Randolph Jefferson'],The mother of Thomas Jefferson was Jane Randolph Jefferson.,nan,nan,nan,nan,nan,nan,nan,nan,nan,nan,nan,nan,nan,nan,nan,nan
What is the capital of Missouri?,"['Jefferson City', 'Jefferson City, Missouri']",The capital of Missouri is Jefferson City.,nan,nan,nan,nan,nan,nan,nan,nan,nan,nan,nan,nan,nan,nan,nan,nan
What is the capital of Andorra?,['Andorra la Vella'],The capital of Andorra is Andorra la Vella.,nan,nan,nan,nan,nan,nan,nan,nan,nan,nan,nan,nan,nan,nan,nan,nan
What is the capital of Belgium?,"['City of Brussels', 'Brussels City', 'Brussels, Belgium', 'Bruxelles', 'Brussel', 'Stad Brussel', 'Ville de Bruxelles', '02', 'BXL', 'Bru', 'Brussels']",The capital of Belgium is Brussels!,nan,nan,nan,nan,nan,nan,nan,nan,nan,nan,nan,nan,nan,nan,nan,nan
What is the capital of Thailand?,"['Bangkok', 'Krung Thep', 'Krungthepmahanakhon Amonrattanakosin Mahintharayutthaya Mahadilokphop Noppharatratchathaniburirom Udomratchaniwetmahasathan Amonphimanawatansathit Sakkathattiyawitsanukamprasit', 'Krung Thep Maha Nakhon']",The capital of Thailand is Bangkok.,nan,nan,nan,nan,nan,nan,nan,nan,nan,nan,nan,nan,nan,nan,nan,nan
What is the capital of Montana?,"['Helena', 'Helena, Montana']",The capital of Montana is Helena.,nan,nan,nan,nan,nan,nan,nan,nan,nan,nan,nan,nan,nan,nan,nan,nan
In what country is BBC?,"['United Kingdom', '🇬🇧', 'UK', 'United Kingdom of Great Britain and Northern Ireland', 'U.K.', 'GBR', 'GB', 'U. K.', 'U K', 'G.B.', 'G. B.', 'G B', 'Great Britain', 'G.B.R.', 'G B R', 'Britain', 'Great Britain and Northern Ireland']",The BBC (British Broadcasting Corporation) is a public service broadcaster based in the United Kingdom (UK).,nan,nan,nan,nan,nan,nan,nan,nan,nan,nan,nan,nan,nan,nan,nan,nan
What is the capital of Malta?,"['Valletta', 'Valleta', 'Capital of Malta', 'Valetta', 'Il-Belt Valletta', 'Città Umilissima', 'La Valleta', 'La Valletta', 'Citta Umilissima']",The capital of Malta is Valletta.,nan,nan,nan,nan,nan,nan,nan,nan,nan,nan,nan,nan,nan,nan,nan,nan
What is Ruby Rose's occupation?,"['disc jockey', 'DJ', 'dee jay', 'dj', 'D.J.', 'disk jockey', 'dee-jay', 'deejay', 'disquaire', 'discaire', 'actor', 'actress', 'actors', 'actresses', 'television presenter', 'host', 'hostess', 'TV host', 'television host', 'TV presenter', 'TV anchor', 'television anchor']","Ruby Rose is an Australian actress, model, and television presenter.",nan,nan,nan,nan,nan,nan,nan,nan,nan,nan,nan,nan,nan,nan,nan,nan
What is the capital of Tennessee?,"['Nashville', 'Nashville, Tennessee', 'Nashville–Davidson County', 'Metropolitan Government of Nashville and Davidson County']",The capital of Tennessee is Nashville!,nan,nan,nan,nan,nan,nan,nan,nan,nan,nan,nan,nan,nan,nan,nan,nan
What is the capital of Connecticut?,"['Hartford', 'Hartford, Connecticut']",The capital of Connecticut is Hartford.,nan,nan,nan,nan,nan,nan,nan,nan,nan,nan,nan,nan,nan,nan,nan,nan
What is the capital of Louisiana?,"['Baton Rouge', 'Baton Rouge, Louisiana', 'Baton Rouge, LA', 'Baton Rouge, La.']",The capital of Louisiana is Baton Rouge.,nan,nan,nan,nan,nan,nan,nan,nan,nan,nan,nan,nan,nan,nan,nan,nan
What is the capital of Portugal?,"['Lisbon', 'Lisboa']",The capital of Portugal is Lisbon (Portuguese: Lisboa).,nan,nan,nan,nan,nan,nan,nan,nan,nan,nan,nan,nan,nan,nan,nan,nan
What is the capital of Wisconsin?,"['Madison', 'Madison, Wisconsin', 'City of Madison']",The capital of Wisconsin is Madison.,nan,nan,nan,nan,nan,nan,nan,nan,nan,nan,nan,nan,nan,nan,nan,nan
What is the capital of Rhode Island?,"['Providence', 'Providence, Rhode Island', 'Providence, RI']",The capital of Rhode Island is Providence.,nan,nan,nan,nan,nan,nan,nan,nan,nan,nan,nan,nan,nan,nan,nan,nan
What is the capital of Oregon?,"['Salem', 'Salem, Oregon']",The capital of Oregon is Salem.,nan,nan,nan,nan,nan,nan,nan,nan,nan,nan,nan,nan,nan,nan,nan,nan
What is the capital of Utah?,"['Salt Lake City', 'Salt Lake', 'SLC', 'Salt Lake City, Utah']",The capital of Utah is Salt Lake City.,nan,nan,nan,nan,nan,nan,nan,nan,nan,nan,nan,nan,nan,nan,nan,nan
Who is the author of Nineteen Eighty-Four?,"['George Orwell', 'Eric Blair', 'P. S. Burton', 'Eric Arthur Blair', 'John Freeman']",The author of Nineteen Eighty-Four is George Orwell.,nan,nan,nan,nan,nan,nan,nan,nan,nan,nan,nan,nan,nan,nan,nan,nan
What genre is Avatar?,"['science fiction film', 'sci-fi film', 'science fiction movie', 'sci-fi movie', 'scifi film', 'scifi movie', 'sci fi film', 'sci fi movie', 'scifi-film', 'scifi']","Avatar (2009) is a science fiction film, specifically a epic space opera.",nan,nan,nan,nan,nan,nan,nan,nan,nan,nan,nan,nan,nan,nan,nan,nan
Who was the producer of Avatar?,"['James Cameron', 'James Francis Cameron', 'Jim Cameron']",James Cameron was the producer of Avatar (2009).,nan,nan,nan,nan,nan,nan,nan,nan,nan,nan,nan,nan,nan,nan,nan,nan
Who was the director of Avatar?,"['James Cameron', 'James Francis Cameron', 'Jim Cameron']",The director of Avatar (2009) was James Cameron.,nan,nan,nan,nan,nan,nan,nan,nan,nan,nan,nan,nan,nan,nan,nan,nan
What is the capital of Oklahoma?,"['Oklahoma City', 'Oklahoma City, Oklahoma', 'OKC', 'Okla. City']",The capital of Oklahoma is Oklahoma City.,nan,nan,nan,nan,nan,nan,nan,nan,nan,nan,nan,nan,nan,nan,nan,nan
What is the capital of Nepal?,"['Kathmandu', 'Kathmandu Metropolitan City', 'Kathmandu Valley', 'Khatmandu', 'City of Temples', 'jiade mandu']",The capital of Nepal is Kathmandu.,nan,nan,nan,nan,nan,nan,nan,nan,nan,nan,nan,nan,nan,nan,nan,nan
What is the capital of Vermont?,"['Montpelier', 'Montpelier, Vermont']",The capital of Vermont is Montpelier.,nan,nan,nan,nan,nan,nan,nan,nan,nan,nan,nan,nan,nan,nan,nan,nan
What is the capital of Mississippi?,"['Jackson', 'Jackson, Mississippi', 'City of Jackson']",The capital of Mississippi is Jackson.,nan,nan,nan,nan,nan,nan,nan,nan,nan,nan,nan,nan,nan,nan,nan,nan
What is the capital of Mauritius?,"['Port Louis', 'Port Louis, Mauritius']",The capital of Mauritius is Port Louis.,nan,nan,nan,nan,nan,nan,nan,nan,nan,nan,nan,nan,nan,nan,nan,nan
What is the capital of Finland?,"['Helsinki', 'Helsingfors', 'Helsingia']",The capital of Finland is Helsinki!,nan,nan,nan,nan,nan,nan,nan,nan,nan,nan,nan,nan,nan,nan,nan,nan
What is the capital of Morocco?,"['Rabat', 'New Sallee']",The capital of Morocco is Rabat.,nan,nan,nan,nan,nan,nan,nan,nan,nan,nan,nan,nan,nan,nan,nan,nan
What is the capital of Serbia?,"['Belgrade', 'City of Belgrade', 'Belgrade, Serbia', 'Beograd', 'Београд']",The capital of Serbia is Belgrade (Beograd in Serbian).,nan,nan,nan,nan,nan,nan,nan,nan,nan,nan,nan,nan,nan,nan,nan,nan
What is the capital of Kentucky?,"['Frankfort', 'Frankfort, Kentucky']",The capital of Kentucky is Frankfort.,nan,nan,nan,nan,nan,nan,nan,nan,nan,nan,nan,nan,nan,nan,nan,nan
What is the capital of Azerbaijan?,"['Baku', 'City of Winds']",The capital of Azerbaijan is Baku (Azerbaijani: Bakı).,nan,nan,nan,nan,nan,nan,nan,nan,nan,nan,nan,nan,nan,nan,nan,nan
What is the capital of Sudan?,['Khartoum'],The capital of Sudan is Khartoum.,nan,nan,nan,nan,nan,nan,nan,nan,nan,nan,nan,nan,nan,nan,nan,nan
What is the capital of Indiana?,"['Indianapolis', 'Circle City', 'Indy', 'Naptown', 'Crossroads of America', 'Racing Capital of the World', 'Amateur Sports Capital of the World', 'INDPLS', 'Indianapolis, Indiana', 'India-no-place', 'Railroad City']",The capital of Indiana is Indianapolis!,nan,nan,nan,nan,nan,nan,nan,nan,nan,nan,nan,nan,nan,nan,nan,nan
What is the capital of Greenland?,"['Nuuk', 'Godthåb', 'Nûk', 'Nuk']",The capital of Greenland is Nuuk!,nan,nan,nan,nan,nan,nan,nan,nan,nan,nan,nan,nan,nan,nan,nan,nan
What is the capital of Albania?,"['Tirana', 'Tirane', 'Tiranë']",The capital of Albania is Tirana!,nan,nan,nan,nan,nan,nan,nan,nan,nan,nan,nan,nan,nan,nan,nan,nan
What is the capital of Iowa?,"['Des Moines', 'Des Moines, Iowa']",The capital of Iowa is Des Moines.,nan,nan,nan,nan,nan,nan,nan,nan,nan,nan,nan,nan,nan,nan,nan,nan
What is the capital of Ethiopia?,"['Addis Ababa', 'Addis Abeba', 'Addis Abäba', 'Finfinne']",The capital of Ethiopia is Addis Ababa.,nan,nan,nan,nan,nan,nan,nan,nan,nan,nan,nan,nan,nan,nan,nan,nan
What is the capital of New Hampshire?,"['Concord', 'Concord, New Hampshire', 'Concord N.H.', 'Concord NH']",The capital of New Hampshire is Concord.,nan,nan,nan,nan,nan,nan,nan,nan,nan,nan,nan,nan,nan,nan,nan,nan
What is the capital of Puerto Rico?,"['San Juan', 'San Juan, Puerto Rico', 'San Juan Bautista', 'San Juan Municipio', 'San Juan de Puerto Rico']",The capital of Puerto Rico is San Juan.,nan,nan,nan,nan,nan,nan,nan,nan,nan,nan,nan,nan,nan,nan,nan,nan
What is the capital of Kansas?,"['Topeka', 'Topeka, Kansas', 'Topeka (Kansas)']",The capital of Kansas is Topeka.,nan,nan,nan,nan,nan,nan,nan,nan,nan,nan,nan,nan,nan,nan,nan,nan
What is the capital of Arkansas?,"['Little Rock', 'Little Rock, Arkansas', 'Little Rock, AR', 'Little Rock, Ark.', 'the Little Rock']",The capital of Arkansas is Little Rock.,nan,nan,nan,nan,nan,nan,nan,nan,nan,nan,nan,nan,nan,nan,nan,nan
In what country is Snapchat?,"['United States of America', 'the United States of America', 'America', 'U.S.A.', 'USA', 'U.S.', 'US', 'the US', 'the USA', 'US of A', 'the United States', 'U. S. A.', 'U. S.', 'the States', 'the U.S.', ""'Merica"", 'U.S', 'United States', ""'Murica""]","Snapchat is an American company, and its headquarters are located in Santa Monica, California, USA.",nan,nan,nan,nan,nan,nan,nan,nan,nan,nan,nan,nan,nan,nan,nan,nan
What is the capital of Idaho?,"['Boise', 'Boise, Idaho']",The capital of Idaho is Boise!,nan,nan,nan,nan,nan,nan,nan,nan,nan,nan,nan,nan,nan,nan,nan,nan
What is the capital of Byzantine Empire?,"['Constantinople', 'Istanbul']",The capital of the Byzantine Empire was Constantinople (modern-day Istanbul).,nan,nan,nan,nan,nan,nan,nan,nan,nan,nan,nan,nan,nan,nan,nan,nan
What is the capital of South Carolina?,"['Columbia', 'Columbia, South Carolina', 'Cola', 'Columbia, SC']",The capital of South Carolina is Columbia.,nan,nan,nan,nan,nan,nan,nan,nan,nan,nan,nan,nan,nan,nan,nan,nan
Who is the author of One Piece?,"['Eiichiro Oda', 'Eiichirō Oda', 'Eiichirou Oda', 'Oda Eiichiro', 'Oda Eiichirō', 'Oda Eiichirou']","The author of the popular manga and anime series ""One Piece"" is Eiichiro Oda.",nan,nan,nan,nan,nan,nan,nan,nan,nan,nan,nan,nan,nan,nan,nan,nan
Who is the father of Wayne Gretzky?,['Walter Gretzky'],The father of Wayne Gretzky is Walter Gretzky.,nan,nan,nan,nan,nan,nan,nan,nan,nan,nan,nan,nan,nan,nan,nan,nan
What is the capital of Nebraska?,"['Lincoln', 'Lincoln, Nebraska']",The capital of Nebraska is Lincoln.,nan,nan,nan,nan,nan,nan,nan,nan,nan,nan,nan,nan,nan,nan,nan,nan
What is the capital of Croatia?,"['Zagreb', 'Agram', 'Zagreb', 'KK Zagreb']",The capital of Croatia is Zagreb.,nan,nan,nan,nan,nan,nan,nan,nan,nan,nan,nan,nan,nan,nan,nan,nan
What is Toronto the capital of?,"['Ontario', 'ONT', 'ON']",Toronto is not the capital of any country. The capital of Canada is Ottawa.,nan,nan,nan,nan,nan,nan,nan,nan,nan,nan,nan,nan,nan,nan,nan,nan
What is the capital of South Dakota?,"['Pierre', 'Pierre, South Dakota', 'Pierre, SD']",The capital of South Dakota is Pierre.,nan,nan,nan,nan,nan,nan,nan,nan,nan,nan,nan,nan,nan,nan,nan,nan
What is the capital of Colombia?,"['Bogotá', 'Santa Fe de Bogotá', 'Santafé de Bogotá', 'Bogota', 'Bogota, Colombia']",The capital of Colombia is Bogotá.,nan,nan,nan,nan,nan,nan,nan,nan,nan,nan,nan,nan,nan,nan,nan,nan
What is Tokyo the capital of?,"['Japan', 'State of Japan', 'Land of the Rising Sun', 'Nihon', 'Nippon', 'JP', 'Nippon-koku', 'Nihon-koku', 'JA', 'JPN', 'jp', 'JAP', 'Ja', 'Jap', 'Empire of Japan', 'Japanese Empire', 'Imperial Japan', 'Great Empire of Japan', 'Great Japanese Empire', 'Αυτοκρατορία της Ιαπωνίας', 'Japan', 'occupation of Japan', 'Japan', 'Allied occupation of Japan', 'Occupied Japan']",Tokyo is the capital of Japan.,nan,nan,nan,nan,nan,nan,nan,nan,nan,nan,nan,nan,nan,nan,nan,nan
What is the capital of Cuba?,"['Havana', 'La Habana', 'Habana', 'Havana, Cuba']",The capital of Cuba is Havana (Spanish: La Habana).,nan,nan,nan,nan,nan,nan,nan,nan,nan,nan,nan,nan,nan,nan,nan,nan
What is the capital of Ireland?,"['Dublin', 'Dublin city', 'City of Dublin', 'Baile Átha Cliath']",The capital of Ireland is Dublin!,nan,nan,nan,nan,nan,nan,nan,nan,nan,nan,nan,nan,nan,nan,nan,nan
What genre is Yoko Ono?,"['Fluxus', 'Neo-Dada', 'Fluxus Collective', 'rock music', 'rock and roll', 'rock', 'Rock', 'experimental music', 'Experimental', 'pop music', 'pop', 'Pop']","Yoko Ono is a Japanese artist, musician, and peace activist. Her work spans multiple genres, including:

1. Experimental music: Ono is known for her avant-garde music, which often incorporates elements of noise, drone, and free improvisation.
2. Pop music: Ono has also released several pop albums, often featuring catchy melodies and lyrics.
3. Electronic music: Ono has experimented with electronic music, incorporating synthesizers, drum machines, and other",nan,nan,nan,nan,nan,nan,nan,nan,nan,nan,nan,nan,nan,nan,nan,nan
What is the capital of Qatar?,['Doha'],The capital of Qatar is Doha.,nan,nan,nan,nan,nan,nan,nan,nan,nan,nan,nan,nan,nan,nan,nan,nan
What color is Juventus F.C.?,"['white', 'W', 'color white', '#FFFFFF']",Juventus F.C. is a black and white striped team.,nan,nan,nan,nan,nan,nan,nan,nan,nan,nan,nan,nan,nan,nan,nan,nan
What is the capital of Hungary?,"['Budapest', 'Buda Pest', 'Buda-Pest', 'Budapešť', 'Budapesta', 'Budapeszt', 'Buda', 'Ofen', 'Budín', 'Budim', 'Budon', 'Pest', 'Pešť', 'Pešta', 'Óbuda', 'Alt-Ofen', 'Kőbánya']",The capital of Hungary is Budapest!,nan,nan,nan,nan,nan,nan,nan,nan,nan,nan,nan,nan,nan,nan,nan,nan
What is the capital of North Dakota?,"['Bismarck', 'Bismarck, North Dakota', 'Bismarck, ND', 'West Bismarck, North Dakota', 'Edwinton, North Dakota', 'Edwinton, ND']",The capital of North Dakota is Bismarck.,nan,nan,nan,nan,nan,nan,nan,nan,nan,nan,nan,nan,nan,nan,nan,nan
What is the capital of Armenia?,"['Yerevan', 'Erivan', 'Erevan', 'The Pink City', 'Irevan', 'Iravan']",The capital of Armenia is Yerevan.,nan,nan,nan,nan,nan,nan,nan,nan,nan,nan,nan,nan,nan,nan,nan,nan
What is the religion of Catholic Church?,"['Catholicism', 'Catholic faith', 'Catholic religion', 'Catholic']",The Catholic Church is a Christian denomination and its religion is Christianity.,nan,nan,nan,nan,nan,nan,nan,nan,nan,nan,nan,nan,nan,nan,nan,nan
What genre is The Thing?,"['horror film', 'horror movie', 'science fiction film', 'sci-fi film', 'science fiction movie', 'sci-fi movie', 'scifi film', 'scifi movie', 'sci fi film', 'sci fi movie', 'scifi-film', 'scifi']",The Thing (1982) is a science fiction horror film.,nan,nan,nan,nan,nan,nan,nan,nan,nan,nan,nan,nan,nan,nan,nan,nan
Who was the screenwriter for The Thing?,"['Bill Lancaster', 'William Henry Lancaster']","The screenwriter for the 1982 film ""The Thing"" was Bill Lancaster.",nan,nan,nan,nan,nan,nan,nan,nan,nan,nan,nan,nan,nan,nan,nan,nan
"What is Tyler, the Creator's occupation?","['record producer', 'music producer', 'actor', 'actress', 'actors', 'actresses', 'graphic designer']","Tyler, the Creator is a rapper, singer, songwriter, record producer, music video director, and fashion designer.",nan,nan,nan,nan,nan,nan,nan,nan,nan,nan,nan,nan,nan,nan,nan,nan
What is the capital of Belarus?,"['Minsk', 'Мінск', 'Менск', 'Минск', 'Mińsk', 'Minskas', 'Mensk', 'Miensk']",The capital of Belarus is Minsk.,nan,nan,nan,nan,nan,nan,nan,nan,nan,nan,nan,nan,nan,nan,nan,nan
What is Rome the capital of?,"['Lazio', 'Province of Rome', 'provincia di Roma', 'Papal States', 'Papal State', 'Church State', 'State of the Church', 'Stato della Chiesa', 'Status Ecclesiae', 'Ecclesiastical States', 'Roman Republic', 'res publica', 'Rome', 'Roman Empire', 'Imperium Romanum', 'Romanum imperium', 'imperium romanum', 'Senatus Populusque Romanus', 'Italy', 'Italia', 'Italian Republic', 'IT', '🇮🇹', 'ITA']",Rome is the capital of Italy.,nan,nan,nan,nan,nan,nan,nan,nan,nan,nan,nan,nan,nan,nan,nan,nan
What is the capital of Barbados?,['Bridgetown'],The capital of Barbados is Bridgetown.,nan,nan,nan,nan,nan,nan,nan,nan,nan,nan,nan,nan,nan,nan,nan,nan
What is Billy Joel's occupation?,"['composer', 'pianist', 'singer-songwriter', 'singer songwriter', 'singer/songwriter', 'singersongwriter', 'singer-songwriter']",Billy Joel is a singer-songwriter and musician.,nan,nan,nan,nan,nan,nan,nan,nan,nan,nan,nan,nan,nan,nan,nan,nan
What genre is Billy Joel?,"['rock music', 'rock and roll', 'rock', 'Rock']","Billy Joel is a singer-songwriter known for his work in the genres of:

* Rock music
* Pop music
* Soft rock
* Adult contemporary

He is often referred to as a ""piano rock"" artist due to his prominent use of the piano in his music.",nan,nan,nan,nan,nan,nan,nan,nan,nan,nan,nan,nan,nan,nan,nan,nan
"Who is the father of John, King of England?","['Henry II of England', 'Henry Curtmantle', 'Henry FitzEmpress', 'Henry Plantagenet', 'Henry II', 'King of England Henry II', 'Henry of Anjou', 'King Henry II of England', 'King Henry II']","The father of John, King of England, is King Henry II of England.",nan,nan,nan,nan,nan,nan,nan,nan,nan,nan,nan,nan,nan,nan,nan,nan
What is the capital of Haiti?,"['Port-au-Prince', 'Port au Prince']",The capital of Haiti is Port-au-Prince.,nan,nan,nan,nan,nan,nan,nan,nan,nan,nan,nan,nan,nan,nan,nan,nan
What color is A.C. Milan?,"['red', 'red color']",A.C. Milan's primary colors are red and black.,nan,nan,nan,nan,nan,nan,nan,nan,nan,nan,nan,nan,nan,nan,nan,nan
What is the capital of British India?,"['Kolkata', 'Calcutta', 'City of Palaces', 'City of Processions', 'City of Joy']",The capital of British India was Calcutta (now known as Kolkata).,nan,nan,nan,nan,nan,nan,nan,nan,nan,nan,nan,nan,nan,nan,nan,nan
Who was the screenwriter for Jurassic Park?,"['Michael Crichton', 'John Michael Crichton', 'Michael Douglas', 'Jeffery Hudson', 'John Lange', 'David Koepp']",The screenwriter for Jurassic Park was David Koepp.,nan,nan,nan,nan,nan,nan,nan,nan,nan,nan,nan,nan,nan,nan,nan,nan
What is the capital of Moldova?,"['Chișinău', 'Chisinau', 'Kishinev', 'Chişinău', 'Keshenev', 'Kischinew', 'Kyshyniv', 'Kiszyniów', 'Kišinìv', 'Kişinev', 'Keshinov', 'Khisinau', 'Kishinëv', 'Kishinef', 'Kiscinev']",The capital of Moldova is Chișinău.,nan,nan,nan,nan,nan,nan,nan,nan,nan,nan,nan,nan,nan,nan,nan,nan
What is the capital of Lithuania?,"['Vilnius', 'Vilna', 'Wilno', 'Vilne', 'Wilna', 'Viļņa', 'Vilnia', 'Vilno', 'Vilnyus']",The capital of Lithuania is Vilnius.,nan,nan,nan,nan,nan,nan,nan,nan,nan,nan,nan,nan,nan,nan,nan,nan
What is the capital of Democratic Republic of the Congo?,"['Kinshasa', 'Léopoldville', 'Leopoldstad', 'Leopoldville']",The capital of the Democratic Republic of the Congo is Kinshasa.,nan,nan,nan,nan,nan,nan,nan,nan,nan,nan,nan,nan,nan,nan,nan,nan
Who is the father of Joan of Arc?,"[""Jacques d'Arc""]","Joan of Arc's father was Jacques d'Arc, a farmer from Domremy, France.",nan,nan,nan,nan,nan,nan,nan,nan,nan,nan,nan,nan,nan,nan,nan,nan
What is the capital of Wales?,"['Cardiff', 'Caerdydd', 'Cardiff, Wales']",The capital of Wales is Cardiff!,nan,nan,nan,nan,nan,nan,nan,nan,nan,nan,nan,nan,nan,nan,nan,nan
What is the capital of Goa?,"['Panaji', 'Pangim', 'Nova Goa', 'Ponnje', 'Panjim']",The capital of Goa is Panaji.,nan,nan,nan,nan,nan,nan,nan,nan,nan,nan,nan,nan,nan,nan,nan,nan
What is the capital of Venezuela?,"['Caracas', 'Ciudad de Caracas Venezuela', 'Santiago de León de Caracas', 'Santiago de Leon de Caracas']",The capital of Venezuela is Caracas.,nan,nan,nan,nan,nan,nan,nan,nan,nan,nan,nan,nan,nan,nan,nan,nan
Who is the father of King Arthur?,['Uther Pendragon'],"According to legend, King Arthur's father is Uther Pendragon.",nan,nan,nan,nan,nan,nan,nan,nan,nan,nan,nan,nan,nan,nan,nan,nan
Who is the mother of King Arthur?,"['Igraine', 'Eigyr']","According to legend, the mother of King Arthur is Igraine, a princess of Cornwall.",nan,nan,nan,nan,nan,nan,nan,nan,nan,nan,nan,nan,nan,nan,nan,nan
What is the capital of Iraq?,"['Baghdad', 'Bagdad', 'Baghdād']",The capital of Iraq is Baghdad.,nan,nan,nan,nan,nan,nan,nan,nan,nan,nan,nan,nan,nan,nan,nan,nan
What is the capital of Dominican Republic?,"['Santo Domingo', 'Santo Domingo, Dominican Republic', 'Santo Domingo de Guzman', 'Santo Domingo de Guzmán']",The capital of the Dominican Republic is Santo Domingo.,nan,nan,nan,nan,nan,nan,nan,nan,nan,nan,nan,nan,nan,nan,nan,nan
What is the capital of Jordan?,['Amman'],The capital of Jordan is Amman.,nan,nan,nan,nan,nan,nan,nan,nan,nan,nan,nan,nan,nan,nan,nan,nan
What is the capital of Bosnia and Herzegovina?,"['Sarajevo', 'City of Sarajevo']",The capital of Bosnia and Herzegovina is Sarajevo.,nan,nan,nan,nan,nan,nan,nan,nan,nan,nan,nan,nan,nan,nan,nan,nan
What is the capital of Ghana?,['Accra'],The capital of Ghana is Accra.,nan,nan,nan,nan,nan,nan,nan,nan,nan,nan,nan,nan,nan,nan,nan,nan
What is the capital of Cape Verde?,['Praia'],The capital of Cape Verde is Praia.,nan,nan,nan,nan,nan,nan,nan,nan,nan,nan,nan,nan,nan,nan,nan,nan
What is the capital of Northern Ireland?,"['Belfast', 'Béal Feirste', 'Beal Feirste', 'Belfast, Ireland']",The capital of Northern Ireland is Belfast.,nan,nan,nan,nan,nan,nan,nan,nan,nan,nan,nan,nan,nan,nan,nan,nan
What is the capital of Bulgaria?,"['Sofia', 'Serdica', 'Sredez', 'Sofija', 'Sredets']",The capital of Bulgaria is Sofia.,nan,nan,nan,nan,nan,nan,nan,nan,nan,nan,nan,nan,nan,nan,nan,nan
What is Boston the capital of?,"['Suffolk County', 'Suffolk County, Massachusetts', 'Massachusetts', 'Bay State', 'Commonwealth of Massachusetts', 'MA', 'Mass.', 'US-MA']",Boston is the capital of Massachusetts.,nan,nan,nan,nan,nan,nan,nan,nan,nan,nan,nan,nan,nan,nan,nan,nan
What is the capital of Estonia?,"['Tallinn', 'Reval', 'Revel', 'Rewel', 'Kolywan', 'Lyndanisse', 'Lindanäs', 'Reuel']",The capital of Estonia is Tallinn.,nan,nan,nan,nan,nan,nan,nan,nan,nan,nan,nan,nan,nan,nan,nan,nan
What is the capital of Jamaica?,"['Kingston', 'Kingston, Jamaica']",The capital of Jamaica is Kingston.,nan,nan,nan,nan,nan,nan,nan,nan,nan,nan,nan,nan,nan,nan,nan,nan
What is the capital of Bhutan?,"['Thimphu', 'Thimpu']",The capital of Bhutan is Thimphu.,nan,nan,nan,nan,nan,nan,nan,nan,nan,nan,nan,nan,nan,nan,nan,nan
Who was the screenwriter for Pulp Fiction?,"['Quentin Tarantino', 'Tarantino', 'Quentin Jerome Tarantino', 'Roger Avary', 'Roger Roberts Avary']",The screenwriter for Pulp Fiction was Quentin Tarantino.,nan,nan,nan,nan,nan,nan,nan,nan,nan,nan,nan,nan,nan,nan,nan,nan
Who is the father of Krishna?,['Vasudeva'],The father of Krishna is Vasudeva.,nan,nan,nan,nan,nan,nan,nan,nan,nan,nan,nan,nan,nan,nan,nan,nan
Who is the mother of Krishna?,['Devaki'],"The mother of Krishna is Devaki, a princess of the Yadava dynasty.",nan,nan,nan,nan,nan,nan,nan,nan,nan,nan,nan,nan,nan,nan,nan,nan
Who is the father of Charles II of England?,"['Charles I of England', 'Charles I', 'King of England Charles I', 'Charles Ist', 'King Charles the Martyr']",The father of Charles II of England is King Charles I of England.,nan,nan,nan,nan,nan,nan,nan,nan,nan,nan,nan,nan,nan,nan,nan,nan
What is the capital of Ontario?,"['Toronto', 'City of Toronto', 'The Six', 'T-O', 'The 416', 'Hogtown']",The capital of Ontario is Toronto.,nan,nan,nan,nan,nan,nan,nan,nan,nan,nan,nan,nan,nan,nan,nan,nan
What is Berlin the capital of?,"['Germany', 'FRG', 'BRD', 'Bundesrepublik Deutschland', 'Federal Republic of Germany', 'de', 'Deutschland', 'GER', 'BR Deutschland', 'DE']",Berlin is the capital of Germany.,nan,nan,nan,nan,nan,nan,nan,nan,nan,nan,nan,nan,nan,nan,nan,nan
What color is FC Internazionale Milano?,"['black', 'key', 'blackness', '#000000']",FC Internazionale Milano's primary colors are black and blue.,nan,nan,nan,nan,nan,nan,nan,nan,nan,nan,nan,nan,nan,nan,nan,nan
Who was the screenwriter for Neon Genesis Evangelion?,"['Yōji Enokido', 'Yoji Enokido', 'Youji Enokido', 'Hideaki Anno', 'Anno Hideaki']",The screenwriter for Neon Genesis Evangelion was Hideaki Anno.,nan,nan,nan,nan,nan,nan,nan,nan,nan,nan,nan,nan,nan,nan,nan,nan
Who was the composer of Neon Genesis Evangelion?,"['Shirō Sagisu', 'Shiro Sagisu', 'Shirou Sagisu', 'Shiroh Sagisu', 'Shirow Sagisu', 'Sagisu Shirō', 'Sagisu Shiro', 'Sagisu Shirou', 'Sagisu Shiroh']",The composer of the soundtrack for the anime series Neon Genesis Evangelion is Shirō Sagisu.,nan,nan,nan,nan,nan,nan,nan,nan,nan,nan,nan,nan,nan,nan,nan,nan
