question,answer,baseline,L6-P4,L6-P6,L8-P4,L8-P6,L10-P4,L10-P6,L12-P4,L14-P4,L16-P4,L18-P4,L20-P4,L22-P4,L24-P4,L26-P4,L28-P4,L30-P4
What is Donald Trump's occupation?,"['actor', 'actress', 'actors', 'actresses', 'socialite', 'prominent person', 'real estate development', 'property development', 'Real estate development', 'politician', 'political leader', 'political figure', 'polit.', 'pol', 'business magnate', 'businessperson', 'tycoon', 'magnate']",Donald Trump's occupation is a businessman and former politician. He was the 45th President of the United States from 2017 to 2021.,Donald Trump's occupation is a businessman and former politician. He was the 45th President of the United States from 2017 to 2021.,Donald Trump's occupation is a businessman and former politician. He was the 45th President of the United States from 2017 to 2021.,Donald Trump's occupation is a businessman and former politician. He was the 45th President of the United States from 2017 to 2021.,Donald Trump's occupation is a businessman and a former politician. He was the 45th President of the United States from 2017 to 2021.,Donald Trump's occupation is a businessman and a former politician. He was the 45th President of the United States from 2017 to 2021.,Donald Trump's occupation is a businessman and a former politician. He was the 45th President of the United States from 2017 to 2021.,"Donald Trump's occupation is a businessman and former politician. He was the 45th President of the United States from 2017 to 2021. Prior to his presidency, Trump was a successful businessman and real estate developer, with a net worth estimated to be over $3 billion.",Donald Trump's occupation is a businessman and a politician. He was the 45th President of the United States from 2017 to 2021.,"Donald Trump's occupation is a businessman and a former politician. He was the 45th President of the United States from 2017 to 2021. Prior to his presidency, Trump was a successful businessman and real estate developer, with a net worth estimated to be over $3 billion.",Donald Trump's occupation is a businessman and a former politician. He was the 45th President of the United States from 2017 to 2021.,Donald Trump's occupation is a businessman and former politician. He was the 45th President of the United States from 2017 to 2021.,Donald Trump's occupation is a businessman and former politician. He was the 45th President of the United States from 2017 to 2021.,Donald Trump's occupation is a businessman and a former politician. He was the 45th President of the United States from 2017 to 2021.,Donald Trump's occupation is a businessman and a former politician. He was the 45th President of the United States from 2017 to 2021.,Donald Trump's occupation is a businessman and former politician. He was the 45th President of the United States from 2017 to 2021.,Donald Trump's occupation is a businessman and a former politician. He was the 45th President of the United States from 2017 to 2021.
Who is the father of Donald Trump?,"['Fred Trump', 'Frederick Christ Trump', 'Fred Christ Trump', 'Frederick Trump', 'Frederick Christ Trump, Jr.', 'Frederick Trump, Jr.', 'Fred Christ Trump, Jr.']",The father of Donald Trump is Fred Trump.,The father of Donald Trump is Fred Trump.,The father of Donald Trump is Fred Trump.,The father of Donald Trump is Fred Trump.,The father of Donald Trump is Fred Trump.,The father of Donald Trump is Fred Trump.,The father of Donald Trump is Fred Trump.,The father of Donald Trump is Fred Trump.,"The father of Donald Trump is Frederick Christ Trump, also known as Fred Trump.",The father of Donald Trump is Fred Trump.,"The father of Donald Trump is Frederick Christ Trump, also known as Fred Trump.","The father of Donald Trump is Frederick Christ Trump, also known as Fred Trump.","The father of Donald Trump is Frederick Christ Trump, also known as Fred Trump.","The father of Donald Trump is Frederick Christ Trump, also known as Fred Trump.","The father of Donald Trump is Frederick Christ Trump, also known as Fred Trump.","The father of Donald Trump is Frederick Christ Trump, also known as Fred Trump.","The father of Donald Trump is Frederick Christ Trump, also known as Fred Trump."
What is the capital of United States of America?,"['Washington, D.C.', 'Washington', 'Washington DC', 'Washington, DC', 'DC', 'D.C.', 'District of Columbia', 'Washington, District of Columbia', 'Washington D.C.', 'The District']","The capital of the United States of America is Washington, D.C.","The capital of the United States of America is Washington, D.C.","The capital of the United States of America is Washington, D.C.","The capital of the United States of America is Washington, D.C.","The capital of the United States of America is Washington, D.C.","The capital of the United States of America is Washington, D.C.","The capital of the United States of America is Washington, D.C.","The capital of the United States of America is Washington, D.C.","The capital of the United States of America is Washington, D.C.","The capital of the United States of America is Washington, D.C.","The capital of the United States of America is Washington, D.C.","The capital of the United States of America is Washington, D.C.","The capital of the United States of America is Washington, D.C.","The capital of the United States of America is Washington, D.C.","The capital of the United States of America is Washington, D.C.","The capital of the United States of America is Washington, D.C.","The capital of the United States of America is Washington, D.C."
Who is the author of Facebook?,"['Eduardo Saverin', 'Eduardo Luiz Saverin', 'Mark Zuckerberg', 'Mark Elliott Zuckerberg', 'Zuck', 'Zuckerberg', 'Mark Elliot Zuckerberg', 'Dustin Moskovitz', 'Chris Hughes']","The authors of Facebook are Mark Zuckerberg, Andrew McCollum, Dustin Moskovitz, Chris Hughes, and Eduardo Saverin.","The authors of Facebook are Mark Zuckerberg, Andrew McCollum, Dustin Moskovitz, Chris Hughes, and Eduardo Saverin.","The authors of Facebook are Mark Zuckerberg, Andrew McCollum, Dustin Moskovitz, Chris Hughes, and Eduardo Saverin.","The authors of Facebook are Mark Zuckerberg, along with his college roommates and fellow Harvard University students Eduardo Saverin, Andrew McCollum, Dustin Moskovitz, and Chris Hughes.","The authors of Facebook are Mark Zuckerberg, Andrew McCollum, Dustin Moskovitz, Chris Hughes, and Eduardo Saverin.","The authors of Facebook are Mark Zuckerberg, along with his college roommates and fellow Harvard University students Eduardo Saverin, Andrew McCollum, Dustin Moskovitz, and Chris Hughes.","The authors of Facebook are Mark Zuckerberg, along with his college roommates and fellow Harvard University students Eduardo Saverin, Andrew McCollum, Dustin Moskovitz, and Chris Hughes.","The authors of Facebook are Mark Zuckerberg, Andrew McCollum, Dustin Moskovitz, Chris Hughes, and Eduardo Saverin.","The authors of Facebook are Mark Zuckerberg, Andrew McCollum, Dustin Moskovitz, Chris Hughes, and Eduardo Saverin.","The authors of Facebook are Mark Zuckerberg, along with his college roommates and fellow Harvard University students Eduardo Saverin, Andrew McCollum, Dustin Moskovitz, and Chris Hughes.","The authors of Facebook are Mark Zuckerberg, along with his college roommates and fellow Harvard University students Eduardo Saverin, Andrew McCollum, Dustin Moskovitz, and Chris Hughes.","The authors of Facebook are Mark Zuckerberg, along with his college roommates and fellow Harvard University students Eduardo Saverin, Andrew McCollum, Dustin Moskovitz, and Chris Hughes.","The authors of Facebook are Mark Zuckerberg, along with his college roommates and fellow Harvard University students Eduardo Saverin, Andrew McCollum, Dustin Moskovitz, and Chris Hughes.","The authors of Facebook are Mark Zuckerberg, along with his college roommates and fellow Harvard University students Eduardo Saverin, Andrew McCollum, Dustin Moskovitz, and Chris Hughes.","The authors of Facebook are Mark Zuckerberg, along with his college roommates and fellow Harvard University students Eduardo Saverin, Andrew McCollum, Dustin Moskovitz, and Chris Hughes.","The author of Facebook is Mark Zuckerberg, along with his college roommates and fellow Harvard University students Eduardo Saverin, Andrew McCollum, Dustin Moskovitz, and Chris Hughes.","The author of Facebook is Mark Zuckerberg, along with his college roommates and fellow Harvard University students Eduardo Saverin, Andrew McCollum, Dustin Moskovitz, and Chris Hughes."
What is the capital of India?,"['New Delhi', 'New Delhi district', 'Nayi Dilli']",The capital of India is New Delhi.,The capital of India is New Delhi.,The capital of India is New Delhi.,The capital of India is New Delhi.,The capital of India is New Delhi.,The capital of India is New Delhi.,The capital of India is New Delhi.,The capital of India is New Delhi.,The capital of India is New Delhi.,The capital of India is New Delhi.,The capital of India is New Delhi.,The capital of India is New Delhi.,The capital of India is New Delhi.,The capital of India is New Delhi.,The capital of India is New Delhi.,The capital of India is New Delhi.,The capital of India is New Delhi.
Who is the father of Elizabeth II?,"['George VI', 'Albert Frederick Arthur George', 'King George VI', 'Albert Windsor', 'Albert Frederick Arthur George Windsor', 'George Windsor', 'Albert', 'Bertie', 'Prince Albert, Duke of York']",The father of Elizabeth II is King George VI.,The father of Elizabeth II is King George VI.,The father of Elizabeth II is King George VI.,The father of Elizabeth II is King George VI.,The father of Elizabeth II is King George VI.,The father of Elizabeth II is King George VI.,The father of Elizabeth II is King George VI.,The father of Elizabeth II is King George VI.,The father of Elizabeth II is King George VI.,The father of Elizabeth II is King George VI.,The father of Elizabeth II is King George VI.,The father of Queen Elizabeth II is King George VI.,The father of Queen Elizabeth II is King George VI.,The father of Queen Elizabeth II is King George VI.,The father of Queen Elizabeth II is King George VI.,The father of Queen Elizabeth II is King George VI.,The father of Elizabeth II is King George VI.
Who is the mother of Elizabeth II?,"['Queen Elizabeth The Queen Mother', 'Elizabeth Bowes-Lyon', 'The Queen Mother', 'Elizabeth Angela Marguerite Bowes-Lyon', 'Queen Consort Elizabeth', 'Lady Elizabeth Bowes-Lyon', 'The Queen Mum']",The mother of Elizabeth II is Queen Elizabeth The Queen Mother (1900-2002).,The mother of Elizabeth II is Queen Elizabeth The Queen Mother (1900-2002).,The mother of Elizabeth II is Queen Elizabeth The Queen Mother (1900-2002).,The mother of Elizabeth II is Queen Elizabeth The Queen Mother (1900-2002).,The mother of Elizabeth II is Queen Elizabeth The Queen Mother (1900-2002).,The mother of Elizabeth II is Queen Elizabeth The Queen Mother (1900-2002).,The mother of Elizabeth II is Queen Elizabeth The Queen Mother (1900-2002).,The mother of Elizabeth II is Queen Elizabeth The Queen Mother (1900-2002).,"The mother of Elizabeth II is Elizabeth Bowes-Lyon, also known as Queen Elizabeth The Queen Mother.",The mother of Elizabeth II is Queen Elizabeth The Queen Mother (1900-2002).,"The mother of Queen Elizabeth II is Elizabeth Bowes-Lyon, also known as Queen Elizabeth The Queen Mother.",The mother of Queen Elizabeth II is Queen Elizabeth The Queen Mother (1900-2002).,The mother of Queen Elizabeth II is Queen Elizabeth The Queen Mother (1900-2002).,The mother of Queen Elizabeth II is Queen Elizabeth The Queen Mother (born Elizabeth Angela Marguerite Bowes-Lyon).,"The mother of Queen Elizabeth II is Elizabeth Bowes-Lyon, also known as Queen Elizabeth The Queen Mother.","The mother of Queen Elizabeth II is Elizabeth Bowes-Lyon, also known as Queen Elizabeth The Queen Mother.","The mother of Elizabeth II is Elizabeth Bowes-Lyon, also known as Queen Elizabeth The Queen Mother."
What is the capital of United Kingdom?,"['London', 'London, UK', 'London, United Kingdom', 'London, England', 'Modern Babylon']",The capital of the United Kingdom is London.,The capital of the United Kingdom is London.,The capital of the United Kingdom is London.,The capital of the United Kingdom is London.,The capital of the United Kingdom is London.,The capital of the United Kingdom is London.,The capital of the United Kingdom is London.,The capital of the United Kingdom is London.,The capital of the United Kingdom is London.,The capital of the United Kingdom is London.,The capital of the United Kingdom is London.,The capital of the United Kingdom is London.,The capital of the United Kingdom is London.,The capital of the United Kingdom is London.,The capital of the United Kingdom is London.,The capital of the United Kingdom is London.,The capital of the United Kingdom is London.
What is the capital of Taiwan?,"['Taipei', 'The City of Azaleas', 'Taipei City', 'Taibei', 'City of Taipei']",The capital of Taiwan is Taipei.,The capital of Taiwan is Taipei.,The capital of Taiwan is Taipei.,The capital of Taiwan is Taipei.,The capital of Taiwan is Taipei.,The capital of Taiwan is Taipei.,The capital of Taiwan is Taipei.,The capital of Taiwan is Taipei.,The capital of Taiwan is Taipei.,The capital of Taiwan is Taipei.,The capital of Taiwan is Taipei.,The capital of Taiwan is Taipei.,The capital of Taiwan is Taipei.,The capital of Taiwan is Taipei.,The capital of Taiwan is Taipei.,The capital of Taiwan is Taipei.,The capital of Taiwan is Taipei.
What is Kanye West's occupation?,"['record producer', 'music producer', 'songwriter', 'song writer']","Kanye West is a rapper, singer, songwriter, record producer, fashion designer, and entrepreneur.","Kanye West is a rapper, singer, songwriter, record producer, fashion designer, and entrepreneur.","Kanye West is a rapper, singer, songwriter, record producer, fashion designer, and entrepreneur.","Kanye West is a rapper, singer, songwriter, record producer, fashion designer, and entrepreneur.","Kanye West is a rapper, singer, songwriter, record producer, fashion designer, and entrepreneur.","Kanye West is a rapper, singer, songwriter, record producer, fashion designer, and entrepreneur.","Kanye West is a rapper, singer, songwriter, record producer, fashion designer, and entrepreneur.","Kanye West is a rapper, singer, songwriter, record producer, fashion designer, and entrepreneur.","Kanye West is a rapper, singer, songwriter, record producer, fashion designer, and entrepreneur.","Kanye West is a rapper, singer, songwriter, record producer, fashion designer, and entrepreneur.","Kanye West is a rapper, singer, songwriter, record producer, fashion designer, and entrepreneur.","Kanye West is a rapper, singer, songwriter, record producer, fashion designer, and entrepreneur.","Kanye West is a rapper, singer, songwriter, record producer, fashion designer, and entrepreneur.","Kanye West is a rapper, singer, songwriter, record producer, fashion designer, and entrepreneur.","Kanye West is a rapper, singer, songwriter, record producer, fashion designer, and entrepreneur.","Kanye West is a rapper, singer, songwriter, record producer, fashion designer, and entrepreneur.","Kanye West is a rapper, singer, songwriter, record producer, fashion designer, and entrepreneur."
Who was the screenwriter for Halloween?,"['Debra Hill', 'John Carpenter', 'John Howard Carpenter']",The screenwriter for the 1978 film Halloween was John Carpenter.,The screenwriter for the 1978 film Halloween was John Carpenter.,The screenwriter for the 1978 film Halloween was John Carpenter.,The screenwriter for the 1978 film Halloween was John Carpenter.,The screenwriter for the 1978 film Halloween was John Carpenter.,The screenwriter for the 1978 film Halloween was John Carpenter.,The screenwriter for the 1978 film Halloween was John Carpenter.,The screenwriter for the 1978 film Halloween was John Carpenter.,"The screenwriter for the original 1978 film ""Halloween"" was John Carpenter.","The screenwriter for the original 1978 film ""Halloween"" was John Carpenter.","The original screenplay for the 1978 film ""Halloween"" was written by John Carpenter.","The original screenplay for the 1978 film ""Halloween"" was written by John Carpenter.","The original screenplay for the 1978 film ""Halloween"" was written by John Carpenter.","The original screenplay for the 1978 film ""Halloween"" was written by John Carpenter.","The screenwriter for the original 1978 film ""Halloween"" was John Carpenter.","The screenwriter for the original 1978 film ""Halloween"" was John Carpenter.","The screenwriter for the original 1978 film ""Halloween"" was John Carpenter."
Who was the composer of Halloween?,"['John Carpenter', 'John Howard Carpenter']",The composer of the iconic theme music for the 1978 film Halloween is John Carpenter.,"The composer of the iconic Halloween theme is John Carpenter. He wrote and composed the music for the 1978 film Halloween, which has since become a classic horror movie.",The composer of the iconic Halloween theme is John Carpenter.,The composer of the iconic theme music for the 1978 film Halloween is John Carpenter.,The composer of the iconic Halloween theme is John Carpenter.,The iconic score for the 1978 film Halloween was composed by John Carpenter.,The iconic score for the 1978 film Halloween was composed by John Carpenter.,The iconic score for the 1978 film Halloween was composed by John Carpenter.,The composer of the iconic theme music for the 1978 film Halloween is John Carpenter.,The composer of the iconic Halloween theme is John Carpenter.,The composer of the iconic Halloween theme is John Carpenter.,The composer of the iconic Halloween theme is John Carpenter.,The composer of the iconic Halloween theme is John Carpenter.,The composer of the iconic Halloween theme is John Carpenter.,The composer of the iconic Halloween theme is John Carpenter.,The composer of the iconic Halloween theme is John Carpenter.,The composer of the iconic Halloween theme is John Carpenter.
What is the capital of Canada?,"['Ottawa', 'Ottawa (Ontario)', 'Bytown']",The capital of Canada is Ottawa.,The capital of Canada is Ottawa.,The capital of Canada is Ottawa!,The capital of Canada is Ottawa.,The capital of Canada is Ottawa.,The capital of Canada is Ottawa.,The capital of Canada is Ottawa.,The capital of Canada is Ottawa.,The capital of Canada is Ottawa!,The capital of Canada is Ottawa.,The capital of Canada is Ottawa.,The capital of Canada is Ottawa.,The capital of Canada is Ottawa.,The capital of Canada is Ottawa.,The capital of Canada is Ottawa.,The capital of Canada is Ottawa.,The capital of Canada is Ottawa.
What is the capital of California?,"['Sacramento', 'Sac-Town', 'Sac', 'The Indomitable City', 'City of Trees', 'The Big Tomato', 'The Capitol City', 'Sacramento, California', 'Camellia City', 'River City']",The capital of California is Sacramento.,The capital of California is Sacramento.,The capital of California is Sacramento.,The capital of California is Sacramento.,The capital of California is Sacramento.,The capital of California is Sacramento!,The capital of California is Sacramento.,The capital of California is Sacramento.,The capital of California is Sacramento.,The capital of California is Sacramento.,The capital of California is Sacramento.,The capital of California is Sacramento.,The capital of California is Sacramento.,The capital of California is Sacramento.,The capital of California is Sacramento.,The capital of California is Sacramento.,The capital of California is Sacramento.
What is Michael Jackson's occupation?,"['record producer', 'music producer', 'beatboxing', 'Human beat box', 'film director', 'movie director', 'director', 'motion picture director', 'screenwriter', 'scenarist', 'writer', 'screen writer', 'script writer', 'scriptwriter', 'actor', 'actress', 'actors', 'actresses', 'composer', 'businessperson', 'business person', 'dealer', 'businesswoman', 'business man', 'business woman', 'businessman', 'singer-songwriter', 'singer songwriter', 'singer/songwriter', 'singersongwriter', 'singer-songwriter', 'poet', 'poetess', 'bard', 'musician', 'musical artist', 'songwriter', 'song writer']","Michael Jackson was a singer, songwriter, and dancer. He was also a record producer and entrepreneur.","Michael Jackson was a singer, songwriter, and dancer. He was also a record producer, actor, and philanthropist.","Michael Jackson was a singer, songwriter, and dancer. He was also a record producer, actor, and philanthropist.","Michael Jackson was a singer, songwriter, and dancer. He was also a record producer, choreographer, and actor.","Michael Jackson was a singer, songwriter, and dancer. He was also a record producer, actor, and philanthropist.","Michael Jackson was a singer, songwriter, and dancer. He was also a record producer, choreographer, and actor.","Michael Jackson was a singer, songwriter, and dancer. He was also a record producer, choreographer, and actor.","Michael Jackson was a singer, songwriter, and dancer. He was also a record producer and choreographer.","Michael Jackson was a singer, songwriter, and dancer. He was known as the ""King of Pop"" and was one of the most popular and influential musicians of all time.","Michael Jackson was a singer, songwriter, and dancer. He was also a record producer and choreographer.","Michael Jackson was a singer, songwriter, and dancer. He was known as the ""King of Pop.""","Michael Jackson was a singer, songwriter, and dancer. He was known as the ""King of Pop.""","Michael Jackson was a singer, songwriter, and dancer. He was known as the ""King of Pop"".","Michael Jackson was a singer, songwriter, and dancer. He was known as the ""King of Pop"".","Michael Jackson was a singer, songwriter, and dancer. He was known as the ""King of Pop"".","Michael Jackson was a singer, songwriter, and dancer. He was known as the ""King of Pop"".","Michael Jackson was a singer, songwriter, and dancer. He is widely regarded as one of the greatest entertainers of all time."
Who is the father of Michael Jackson?,"['Joe Jackson', 'Joseph Walter Jackson']",The father of Michael Jackson is Joseph Walter Jackson.,The father of Michael Jackson is Joseph Walter Jackson.,The father of Michael Jackson is Joseph Walter Jackson.,The father of Michael Jackson is Joseph Walter Jackson.,The father of Michael Jackson is Joseph Walter Jackson.,The father of Michael Jackson is Joseph Walter Jackson.,The father of Michael Jackson is Joseph Walter Jackson.,The father of Michael Jackson is Joseph Walter Jackson.,The father of Michael Jackson is Joseph Walter Jackson.,The father of Michael Jackson is Joseph Walter Jackson.,The father of Michael Jackson is Joseph Walter Jackson.,The father of Michael Jackson is Joseph Walter Jackson.,The father of Michael Jackson is Joseph Walter Jackson.,The father of Michael Jackson is Joseph Walter Jackson.,The father of Michael Jackson is Joseph Walter Jackson.,The father of Michael Jackson is Joseph Walter Jackson.,The father of Michael Jackson is Joseph Walter Jackson.
Who is the mother of Michael Jackson?,"['Katherine Jackson', 'Kattie B. Screws', 'Katherine Scruse', 'Katherine Esther Scruse', 'Katherine Esther Jackson']",The mother of Michael Jackson is Katherine Esther Jackson (née Scruse).,The mother of Michael Jackson is Katherine Esther Jackson (née Scruse).,The mother of Michael Jackson is Katherine Esther Jackson.,The mother of Michael Jackson is Katherine Esther Jackson (née Scruse).,The mother of Michael Jackson is Katherine Esther Jackson (née Scruse).,The mother of Michael Jackson is Katherine Esther Jackson.,The mother of Michael Jackson is Katherine Esther Jackson.,The mother of Michael Jackson is Katherine Esther Jackson (née Scruse).,The mother of Michael Jackson is Katherine Esther Jackson (née Scruse).,The mother of Michael Jackson is Katherine Esther Jackson (née Scruse).,The mother of Michael Jackson is Katherine Esther Jackson (née Scruse).,The mother of Michael Jackson is Katherine Esther Jackson (née Scruse).,The mother of Michael Jackson is Katherine Esther Jackson (née Scruse).,The mother of Michael Jackson is Katherine Esther Jackson (née Scruse).,The mother of Michael Jackson is Katherine Esther Jackson (née Scruse).,The mother of Michael Jackson is Katherine Esther Jackson (née Scruse).,The mother of Michael Jackson is Katherine Esther Jackson (née Scruse).
What is the capital of People's Republic of China?,"['Beijing', 'Peking', 'Beiping', 'Peiping', 'Yanjing', 'Zhongdu', 'Khanbaliq', 'BJ', 'Shun Tian Fu', 'Pekin', 'beijing']",The capital of the People's Republic of China is Beijing ().,The capital of the People's Republic of China is Beijing ().,The capital of the People's Republic of China is Beijing.,The capital of the People's Republic of China is Beijing.,The capital of the People's Republic of China is Beijing ().,The capital of the People's Republic of China is Beijing ().,The capital of the People's Republic of China is Beijing ().,The capital of the People's Republic of China is Beijing ().,The capital of the People's Republic of China is Beijing ().,The capital of the People's Republic of China is Beijing.,The capital of the People's Republic of China is Beijing.,The capital of the People's Republic of China is Beijing.,The capital of the People's Republic of China is Beijing.,The capital of the People's Republic of China is Beijing.,The capital of the People's Republic of China is Beijing.,The capital of the People's Republic of China is Beijing.,The capital of the People's Republic of China is Beijing.
